Title,Content
Google AI Breakthrough,Larry Page announced new advancements in AI at Google AI Labs in Mountain View.
Meta Leadership Change,Sheryl Sandberg resigned from her position at Meta in Palo Alto.
Dell Expands Product Line,Michael Dell introduced a new range of laptops for Dell Technologies in Texas.
SpaceX Rocket Launch,Elon Musk tested a new rocket for SpaceX at Cape Canaveral.
Virgin Galactic Flights,Richard Branson launched a new space tourism program with Virgin Galactic in New Mexico.
Pope's Humanitarian Meeting,Pope Francis met with world leaders at the Vatican City to discuss humanitarian efforts.
Hillary Clinton at Columbia,Hillary Clinton delivered a keynote speech at Columbia University in New York.
China Signs Trade Deal,Xi Jinping signed a trade deal with the World Trade Organization in Beijing.
Biden's EV Initiative,Joe Biden visited Ford Motors in Detroit to discuss electric vehicle production.
New Zealand Policy Updates,Jacinda Ardern introduced new policies at the New Zealand Parliament in Wellington.
Durant's Brooklyn Contract,Kevin Durant extended his contract with the Brooklyn Nets in New York.
Rapinoe Leads USWNT,Megan Rapinoe led the US Women's Soccer Team to victory in Los Angeles.
Ronaldo in Lisbon,Cristiano Ronaldo trained with the Portugal National Team in Lisbon.
Hamilton Wins Monaco GP,Lewis Hamilton won the Formula 1 Grand Prix in Monaco.
Nadal Triumphs in Paris,Rafael Nadal won another title at Roland Garros in Paris.
Ed Sheeran's Charity Concert,Ed Sheeran performed at a charity event for BBC Music in London.
Aniston Joins HBO,Jennifer Aniston joined the cast of a new show produced by HBO Max in Los Angeles.
Pattinson at Warner Bros,Robert Pattinson attended a press conference for Warner Bros in Hollywood.
Hemsworth's Marvel Contract,Chris Hemsworth signed a new contract with Marvel Studios in Sydney.
Lady Gaga at Super Bowl,Lady Gaga performed the national anthem at the Super Bowl in Tampa Bay.
mRNA Research Nobel Prize,Dr. Katalin Karikó received a Nobel Prize for her work on mRNA vaccines at a ceremony in Stockholm.
Fauci on Pandemic,Anthony Fauci discussed pandemic preparedness at Johns Hopkins University in Baltimore.
NIH Announces Research,Dr. Francis Collins announced new research funding at the National Institutes of Health in Washington D.C.
Jane Goodall's Conservation Summit,Dr. Jane Goodall hosted a conservation summit at the Jane Goodall Institute in Tanzania.
Harvard Genomics Lecture,Dr. Eric Lander gave a lecture on genomics at Harvard Medical School in Boston.
Tesla Expands in Shanghai,Elon Musk announced that Tesla would open a new factory in Shanghai.
Ackman at Goldman Sachs,Bill Ackman shared investment insights at a Goldman Sachs conference in New York.
Dimon on Banking,Jamie Dimon spoke about banking trends at a JPMorgan Chase event in Chicago.
Dalio Predicts Market Changes,Ray Dalio predicted market changes in an interview with Bloomberg in Hong Kong.
Buffett's Shareholder Meeting,Warren Buffett attended a shareholder meeting for Berkshire Hathaway in Omaha.
Tyson on Space,Neil deGrasse Tyson discussed space exploration at the Hayden Planetarium in New York.
MIT Black Hole Imaging,Dr. Katie Bouman presented black hole imaging research at MIT in Cambridge.
Buzz Aldrin at NASA,Buzz Aldrin attended a space conference at NASA Headquarters in Houston.
Mae Jemison's Speech,Mae Jemison gave a speech at the Smithsonian National Air and Space Museum in Washington D.C.
Brian Greene on Quantum Physics,Dr. Brian Greene explained quantum mechanics at Columbia University in New York.
Mueller Testifies,Robert Mueller testified before the U.S. Congress in Washington D.C.
Harris on Law Enforcement,Kamala Harris announced new law enforcement policies at the Department of Justice in Los Angeles.
Giuliani in Court,Rudy Giuliani attended a legal hearing at the Supreme Court in New York.
Maxwell's Federal Trial,Ghislaine Maxwell faced trial at the Federal Court in Manhattan.
Snowden on Privacy,Edward Snowden spoke about privacy laws at a virtual event hosted by Amnesty International from Russia.
Amazon Expands in India,Jeff Bezos announced new Amazon warehouses in Mumbai.
Microsoft AI Research,Satya Nadella revealed a new AI initiative at Microsoft HQ in Redmond.
IBM Quantum Computing,Arvind Krishna introduced new quantum computing breakthroughs at IBM Research in New York.
Facebook Privacy Policies,Mark Zuckerberg discussed new privacy policies at Meta HQ in Menlo Park.
Netflix Original Series,Reed Hastings launched a new Netflix original series in Los Angeles.
Toyota's EV Plans,Akio Toyoda unveiled Toyota's electric vehicle roadmap in Tokyo.
Apple's iPhone Launch,Tim Cook introduced the latest iPhone at Apple Park in Cupertino.
Zoom Acquires Startups,Eric Yuan announced Zoom's acquisition of a startup in San Francisco.
Hyundai Invests in AI,Euisun Chung discussed AI-powered cars at Hyundai HQ in Seoul.
Tesla's Berlin Factory,Elon Musk opened Tesla's Gigafactory in Berlin.
Twitter's Content Policy,Jack Dorsey updated Twitter's content moderation policies in San Francisco.
Coca-Cola's New Campaign,James Quincey revealed Coca-Cola's global marketing campaign in Atlanta.
Pfizer's Vaccine Expansion,Albert Bourla announced new vaccine production in Belgium.
Disney's Streaming Success,Bob Chapek shared Disney+'s growth at Walt Disney Studios in Burbank.
Uber's Autonomous Cars,Dara Khosrowshahi showcased Uber's self-driving technology in Pittsburgh.
NASA Mars Mission,Bill Nelson revealed NASA's plans for Mars exploration in Houston.
Harvard's AI Program,Claudine Gay announced Harvard's new AI research center in Boston.
Stanford Medical Breakthrough,Marc Tessier-Lavigne shared Stanford's latest medical research in California.
World Bank's Economic Outlook,David Malpass presented the global economic outlook at World Bank HQ in Washington D.C.
Google's Privacy Sandbox,Sundar Pichai detailed Google's new privacy-focused web initiative in Mountain View.
Ford's Electric Revolution,Jim Farley announced Ford's commitment to electric vehicles in Detroit.
Samsung's Chip Technology,Lee Jae-yong unveiled Samsung's latest semiconductor innovations in Seoul.
Netflix Wins Emmy,Ted Sarandos celebrated Netflix's Emmy wins in Hollywood.
Intel's Next-Gen Processors,Pat Gelsinger introduced Intel's new processors at a tech conference in San Jose.
Chevron's Green Energy Plan,Mike Wirth revealed Chevron's green energy strategy in Houston.
Nike's Sustainable Fashion,John Donahoe showcased Nike's sustainable footwear in Portland.
Spotify's Podcast Expansion,Daniel Ek announced new Spotify podcast partnerships in Stockholm.
Red Cross Relief Efforts,Gail McGovern discussed Red Cross disaster relief in Geneva.
WHO's Pandemic Report,Dr. Tedros Adhanom Ghebreyesus presented WHO's pandemic response report in Geneva.
IMF's Global Economy Update,Kristalina Georgieva gave an economic forecast at IMF headquarters in Washington D.C.
EU Climate Summit,Ursula von der Leyen led the European Union's climate summit in Brussels.
UNICEF's Child Welfare Initiative,Catherine Russell announced new UNICEF programs in New York.
Hollywood's Diversity Push,Ava DuVernay spoke about diversity in Hollywood at a film festival in Los Angeles.
Google's AI Ethics Debate,Jeff Dean led a discussion on AI ethics at Google Research in Mountain View.
New York Times Expansion,Meredith Kopit Levien announced NYT's global expansion in New York.
Oracle Cloud Innovations,Safra Catz introduced new Oracle cloud solutions in Austin.
SpaceX Lunar Mission,Elon Musk shared SpaceX's lunar mission plans at Kennedy Space Center in Florida.
UK's Post-Brexit Trade Deal,Rishi Sunak signed a post-Brexit trade agreement in London.
Germany's Renewable Energy Plan,Olaf Scholz outlined Germany's renewable energy strategy in Berlin.
Paris Fashion Week Highlights,Anna Wintour attended the Paris Fashion Week in Paris.
Formula 1 Grand Prix in Monaco,Max Verstappen won the Monaco Grand Prix in Monte Carlo.
Wimbledon Tennis Championship,Novak Djokovic won the Wimbledon final in London.
NBA Finals MVP,Stephen Curry was named MVP at the NBA Finals in San Francisco.
Amazon's Cloud Expansion,Adam Selipsky announced AWS's new cloud regions in Singapore.
Mercedes-Benz EV Lineup,Ola Källenius revealed Mercedes-Benz's electric vehicle lineup in Stuttgart.
Hollywood's Box Office Record,Tom Cruise's latest movie broke box office records in Los Angeles.
Dimon on Banking,Jamie Dimon spoke about banking trends at a JPMorgan Chase event in Chicago.
Dalio Predicts Market Changes,Ray Dalio predicted market changes in an interview with Bloomberg in Hong Kong.
Buffett's Shareholder Meeting,Warren Buffett attended a shareholder meeting for Berkshire Hathaway in Omaha.
Tyson on Space,Neil deGrasse Tyson discussed space exploration at the Hayden Planetarium in New York.
MIT Black Hole Imaging,Dr. Katie Bouman presented black hole imaging research at MIT in Cambridge.
Buzz Aldrin at NASA,Buzz Aldrin attended a space conference at NASA Headquarters in Houston.
Mae Jemison's Speech,Mae Jemison gave a speech at the Smithsonian National Air and Space Museum in Washington D.C.
Brian Greene on Quantum Physics,Dr. Brian Greene explained quantum mechanics at Columbia University in New York.
Mueller Testifies,Robert Mueller testified before the U.S. Congress in Washington D.C.
Harris on Law Enforcement,Kamala Harris announced new law enforcement policies at the Department of Justice in Los Angeles.
Giuliani in Court,Rudy Giuliani attended a legal hearing at the Supreme Court in New York.
Maxwell's Federal Trial,Ghislaine Maxwell faced trial at the Federal Court in Manhattan.
Snowden on Privacy,Edward Snowden spoke about privacy laws at a virtual event hosted by Amnesty International from Russia.
